{
  "id": "phrase.clarify.repeat_request_01",
  "kind": "phrase",
  "canonical_text": "Could you please repeat that?",
  "intent": "request_clarification",
  "difficulty": 2,
  "scenario_tags": ["supervisor", "shopfloor", "first_week"],
  "representations": {
    "audio_native": { "uri": "content/audio/clarify_repeat_01_native.mp3", "duration_ms": 1420, "mime_type": "audio/mpeg" },
    "audio_slow": { "uri": "content/audio/clarify_repeat_01_slow.mp3", "duration_ms": 2380, "mime_type": "audio/mpeg" },
    "isl_clip": { "uri": "content/isl/clarify_repeat_01.mp4", "gloss": "AGAIN SAY PLEASE", "duration_ms": 2100 },
    "pictographs": [
      { "set": "arasaac", "id": 2462, "label": "again" },
      { "set": "arasaac", "id": 11331, "label": "say" }
    ],
    "easy_read": "I did not hear.\nI ask again.\nI say: Please say it again.",
    "caption": "Could you please repeat that?",
    "phonemes": "k ʊ d j uː p l iː z r ɪ ˈp iː t ð æ t"
  },
  "interaction": {
    "accepted_input_modes": ["speech", "text", "aac", "sign", "switch"],
    "target_response": { "type": "phrase_match", "ref": "phrase.clarify.repeat_request_01" },
    "hints": ["Start with 'Could you'", "Ask politely — you have every right to ask"],
    "distractors": ["What did you say?", "Say again!", "I don't understand you."],
    "common_errors": ["omitting 'please'", "rising intonation missing"]
  },
  "a11y": {
    "requires_audio": false,
    "requires_vision": false,
    "requires_speech": false
  },
  "version": 1,
  "source": "authored"
}
